{
  "contract": "extraction",
  "version": "v1",
  "extraction_id": "extraction:gc_item_8",
  "artifact_id": "gc_item_8",
  "status": "success",
  "extracted_text": "Remote income\n\nConsulting idea around AI workflows.",
  "sections": [
    {
      "label": "section_1",
      "char_start": 0,
      "char_end": 13
    },
    {
      "label": "section_2",
      "char_start": 15,
      "char_end": 51
    }
  ],
  "tables": [],
  "entities": [],
  "warnings": [],
  "metadata": {
    "object_id": "extraction:gc_item_8",
    "schema_version": "v1",
    "created_at": "2026-03-15T12:15:00Z",
    "updated_at": "2026-03-15T12:15:00Z",
    "source_system": "garbage_collector",
    "pipeline_run_id": "remote_workflow_v1b-case-01",
    "confidence": 1.0,
    "tags": [
      "artifact-lane",
      "extraction"
    ],
    "lineage": [
      "gc_item_8"
    ]
  },
  "provenance": {
    "source_artifact_id": "gc_item_8",
    "transform": "artifact_to_extraction",
    "transform_version": "v1"
  }
}